Id,Title,Tags,Acceptance,Difficulty,Frequency,Link
153,Find Minimum in Rotated Sorted Array,"Array, Binary Search",45.2%,Medium,12.0364,https://leetcode.com/problems/find-minimum-in-rotated-sorted-array
200,Number of Islands,"Depth-first Search, Breadth-first Search, Union Find",47.1%,Medium,5.4195,https://leetcode.com/problems/number-of-islands
207,Course Schedule,"Depth-first Search, Breadth-first Search, Graph, Topological Sort",43.3%,Medium,23.3573,https://leetcode.com/problems/course-schedule
311,Sparse Matrix Multiplication,Hash Table,62.2%,Medium,58.8512,https://leetcode.com/problems/sparse-matrix-multiplication
528,Random Pick with Weight,"Binary Search, Random",44.1%,Medium,32.0121,https://leetcode.com/problems/random-pick-with-weight
616,Add Bold Tag in String,String,43.3%,Medium,100.0,https://leetcode.com/problems/add-bold-tag-in-string
1152,Analyze User Website Visit Pattern,"Array, Hash Table, Sort",43.7%,Medium,73.1609,https://leetcode.com/problems/analyze-user-website-visit-pattern
